### ISSUE TITLE
Investigate OpenSSL Performance Issue

### ISSUE THREAD

**Issue by KodrAus** [benashford/rs-es#105]
Howdy!

Firstly, sorry this isn't a very well organised issue, I'm kind of still investigating it. 

I've noticed that when including the `ssl` feature I get a performance decrease when making requests, even though I'm not actually using TLS (still just plain HTTP).

This may fall in the _not worth it basket_ since the difference is actually only ~0.3ms per request, but I thought it was worth looking at. In a simple localhost query benchmark:

## rs-es with default-features

```
$ target/release/rs-es_bench 1000
took mean 620981ns
Percentile 50%: 566407ns
Percentile 66%: 592921ns
Percentile 75%: 612766ns
Percentile 80%: 629631ns
Percentile 90%: 671301ns
Percentile 95%: 807093ns
Percentile 98%: 1560135ns
Percentile 99%: 1927195ns
Percentile 100%: 8266712ns
```

![with-ssl](https://cloud.githubusercontent.com/assets/6721458/23147130/4673b80c-f828-11e6-8b42-5d16544f25b5.png)

## rs-es without default features

```
$ target/release/rs-es_bench 1000
took mean 349419ns
Percentile 50%: 309619ns
Percentile 66%: 326718ns
Percentile 75%: 338294ns
Percentile 80%: 347188ns
Percentile 90%: 369699ns
Percentile 95%: 409512ns
Percentile 98%: 1302209ns
Percentile 99%: 1533335ns
Percentile 100%: 3052977ns
```

![without-ssl](https://cloud.githubusercontent.com/assets/6721458/23147135/4fabad44-f828-11e6-9310-316a5a92992f.png)

I haven't dug into `rs-es` specifically to find out why yet, but I don't get this issue with `reqwest` which is using the same version of `hyper`, but with `hyper-native-tls` so maybe looking at how `reqwest` is holding the `hyper::Client` would help, and let us use TLS on Windows too.

**Comment by benashford** [comment]
Thanks for this, it's very interesting.  I'll take a look into `reqwest`, there may well be some lessons we can learn from it.

I also think there's a few other potential improvements in terms of performance, for example making sure the `keep-alive` header is set to benefit from reused connections.  I think that one is already in another issue somewhere too.

**Comment by KodrAus** [comment]
I checked out the `keep-alive` and it looks like the connections are persistent by default, since `hyper`s client only speaks HTTP 1.1, and Elasticsearch defaults to a 30 second timeout. I did a quick check with Wireshark and used a single `rs-es` client to make 5 sequential requests to confirm the connection isn't closed until the client is dropped:

```
TCP      74     43314→9200 [SYN] Seq=0
TCP      74     9200→43314 [SYN, ACK] Seq=0 Ack=1
TCP      66     43314→9200 [ACK] Seq=1 Ack=1

HTTP     206    POST /bench_index/bench_doc/_search HTTP/1.1
HTTP     1727   HTTP/1.1 200 OK  (application/json)

HTTP     206    POST /bench_index/bench_doc/_search HTTP/1.1
HTTP     1727   HTTP/1.1 200 OK  (application/json)

HTTP     206    POST /bench_index/bench_doc/_search HTTP/1.1
HTTP     1727   HTTP/1.1 200 OK  (application/json)

HTTP     206    POST /bench_index/bench_doc/_search HTTP/1.1
HTTP     1727   HTTP/1.1 200 OK  (application/json)

HTTP     206    POST /bench_index/bench_doc/_search HTTP/1.1
HTTP     1727   HTTP/1.1 200 OK  (application/json)

TCP      66     43314→9200 [FIN, ACK] Seq=701 Ack=8306
TCP      66     9200→43314 [FIN, ACK] Seq=8306 Ack=702
TCP      66     43314→9200 [ACK] Seq=702 Ack=8307
```

So that all looks good. Do you think there are cases where it would be better to explicitly set the `keep-alive`?
